results/spatiotemp_model_selection_table.csv

"formulas","df","AICc","deltaic","weights","MarginalR2","ConditionalR2"
"lumMean_m ~ s(lon, lat) + Age",8.64,-1242.35,0,0.54,NA,NA
"lumMean_m ~ s(lat) + Age",7.83,-1241.41,0.94,0.34,NA,NA
"lumMean_m ~ s(lon, lat, by = Year) + Age",27.2,-1237.77,4.57,0.055,NA,NA
"lumMean_m ~ Year + Age",9,-1237.57,4.78,0.05,NA,NA
"lumMean_m ~ s(lon, lat) + Year + Age",13.16,-1234.57,7.78,0.011,NA,NA
"lumMean_m ~ s(lon, lat, by = Year) + Year + Age",30.3,-1232.8,9.54,0.0046,NA,NA
"lumMean_m ~ lat + (1 | Year) + Age",5,-1193.62,48.72,1.4e-11,0.46,0.51
"lumMean_m ~ 1 + Age",3,-1138.66,103.69,1.7e-23,NA,NA

R_scripts/05_Plumage_Env.md

##                                                       formulas    df     AICc

## mod2d                            lumMean_m ~ s(lon, lat) + Age  8.64 -1242.35
    ## mod2dL                                lumMean_m ~ s(lat) + Age  7.83 -1241.41
    ## mod2dbyY              lumMean_m ~ s(lon, lat, by = Year) + Age 27.20 -1237.77
    ## modlmY                                  lumMean_m ~ Year + Age  9.00 -1237.57
    ## mod2dY                    lumMean_m ~ s(lon, lat) + Year + Age 13.16 -1234.57
    ## mod2dYY        lumMean_m ~ s(lon, lat, by = Year) + Year + Age 30.30 -1232.80
    ## modlmlat_randY              lumMean_m ~ lat + (1 | Year) + Age  5.00 -1193.62
    ## modnull                                    lumMean_m ~ 1 + Age  3.00 -1138.66
    ##                deltaic weights MarginalR2 ConditionalR2
    ## mod2d             0.00 5.4e-01         NA            NA
    ## mod2dL            0.94 3.4e-01         NA            NA
    ## mod2dbyY          4.57 5.5e-02         NA            NA
    ## modlmY            4.78 5.0e-02         NA            NA
    ## mod2dY            7.78 1.1e-02         NA            NA
    ## mod2dYY           9.54 4.6e-03         NA            NA
    ## modlmlat_randY   48.72 1.4e-11       0.46          0.51
    ## modnull         103.69 1.7e-23         NA            NA